{
  "action_domain": [
    {
      "action": "fault_enable:disabled__load_response_delay_cycles:0",
      "parameters": {
        "fault_enable": "disabled",
        "load_response_delay_cycles": 0
      },
      "point_id": "point:v1:fb32334d09626bbb885fa6ad8cfa7ef8356c7121e071bc13f43f2fe482a40d4b"
    },
    {
      "action": "fault_enable:disabled__load_response_delay_cycles:1",
      "parameters": {
        "fault_enable": "disabled",
        "load_response_delay_cycles": 1
      },
      "point_id": "point:v1:2869316dcbeea128848a1e7cd8ecafa29c621e4b6bc878cd476ca8ce4aa637b9"
    },
    {
      "action": "fault_enable:guarded_bit0__load_response_delay_cycles:0",
      "parameters": {
        "fault_enable": "guarded_bit0",
        "load_response_delay_cycles": 0
      },
      "point_id": "point:v1:39641e789b43093f764900a215a6061004c827afe48fe5249774d89889b29727"
    },
    {
      "action": "fault_enable:guarded_bit0__load_response_delay_cycles:1",
      "parameters": {
        "fault_enable": "guarded_bit0",
        "load_response_delay_cycles": 1
      },
      "point_id": "point:v1:95a1749bf79e8479e0cbac2c20ff2ecf3f6c5058b9b2cbe48087a034c1310e0c"
    }
  ],
  "action_domain_sha256": "b048b443ecacb4a175926c14eea634837930413710202af2636f79342ffce6f8",
  "backends": [
    {
      "backend_id": "cpu",
      "executor_identity": "ibex2188-cpu-runner:v1",
      "kind": "cpu",
      "resident_width": 1
    },
    {
      "backend_id": "gpu",
      "executor_identity": "ibex2188-gpu-runner:v1",
      "kind": "gpu",
      "resident_width": 2
    }
  ],
  "comparisons": [
    {
      "comparison_id": "selector-on-gpu",
      "kind": "selector",
      "trial_ids": [
        "random_gpu",
        "stratified_gpu",
        "ordered_refinement_gpu",
        "novelty_gpu"
      ]
    },
    {
      "comparison_id": "random-backend",
      "kind": "backend",
      "trial_ids": [
        "random_cpu",
        "random_gpu"
      ]
    }
  ],
  "experiment_id": "ibex2188-boundary-v1",
  "reconstructor": {
    "algorithm_version": 1,
    "kind": "nearest_observed_graph"
  },
  "schema_version": 1,
  "surface": "rtl_boundary_experiment_contract",
  "sweep_space": {
    "axes": [
      {
        "adjacent_value_pairs": [
          [
            "disabled",
            "guarded_bit0"
          ]
        ],
        "kind": "categorical",
        "name": "fault_enable",
        "values": [
          "disabled",
          "guarded_bit0"
        ]
      },
      {
        "kind": "ordered",
        "name": "load_response_delay_cycles",
        "values": [
          0,
          1
        ]
      }
    ],
    "schema_version": 1,
    "surface": "rtl_boundary_sweep_space"
  },
  "sweep_space_sha256": "781a94cd68240a327a75139341938a0cb56c19e66c3e9ea6729fe484a5f89b22",
  "target": {
    "checkpoint_identity": "directed_load_dependent_branch_one_cycle_response_v1",
    "ip": "ibex_core",
    "issue": "https://github.com/lowRISC/ibex/issues/2188",
    "oracle_field": "oracle_violation",
    "oracle_identity": "ibex2188.ecc_read_error_requires_major_alert_when_no_wb_forwarding.v1",
    "revisions": {
      "bad": "668233699df9ec2a40413e69e0de0a5b10185980",
      "fixed": "9e4a950aa6aa0e20eb638aeeb78743d4a9ddaaeb"
    },
    "semantic_manifest_sha256": {
      "bad": "d7ea635c0e1c71c8df445a1f641420a057d17e88acd29b35190c70965d90a38e",
      "fixed": "4bcee9756dcfb4b5a159114235227dcdfb00ada25298c376115bdce6b54b8bee"
    },
    "semantic_observables": [
      "rf_read_enable",
      "rf_wb_match",
      "rf_write_wb",
      "rf_ecc_error_id",
      "instruction_valid_id",
      "alert_major_internal"
    ],
    "target_id": "ibex2188"
  },
  "trials": [
    {
      "backend_id": "gpu",
      "budget_logical_bad_queries": 2,
      "policy": {
        "algorithm_version": 1,
        "configuration": {},
        "kind": "random",
        "seed_sha256": "e474b9a14b2bc686bedf33243cdcfb7c2b80e236a12d5423cf18372ba956e9d2"
      },
      "requested_count": 2,
      "trial_id": "random_gpu"
    },
    {
      "backend_id": "gpu",
      "budget_logical_bad_queries": 2,
      "policy": {
        "algorithm_version": 1,
        "configuration": {
          "strata_axes": [
            "fault_enable"
          ]
        },
        "kind": "stratified",
        "seed_sha256": "df3ee25aeda706ed9d9fa633d5071c2331bfe1594c535758c2a50e1cd5e4874b"
      },
      "requested_count": 2,
      "trial_id": "stratified_gpu"
    },
    {
      "backend_id": "gpu",
      "budget_logical_bad_queries": 2,
      "policy": {
        "algorithm_version": 1,
        "configuration": {
          "axis": "load_response_delay_cycles"
        },
        "kind": "ordered_refinement",
        "seed_sha256": "ab991d2efc1e759832912f9a9d9892a7d24fdd95fc3532de0a1423e9ee16d16b"
      },
      "requested_count": 2,
      "trial_id": "ordered_refinement_gpu"
    },
    {
      "backend_id": "gpu",
      "budget_logical_bad_queries": 2,
      "policy": {
        "algorithm_version": 1,
        "configuration": {},
        "kind": "novelty_boundary_guided",
        "seed_sha256": "4f13f45e2e98e1419cf73adbec1e4e7fbea61955fcbdc3d04714afa2dd4c17f9"
      },
      "requested_count": 2,
      "trial_id": "novelty_gpu"
    },
    {
      "backend_id": "cpu",
      "budget_logical_bad_queries": 2,
      "policy": {
        "algorithm_version": 1,
        "configuration": {},
        "kind": "random",
        "seed_sha256": "e474b9a14b2bc686bedf33243cdcfb7c2b80e236a12d5423cf18372ba956e9d2"
      },
      "requested_count": 2,
      "trial_id": "random_cpu"
    }
  ]
}
